{
  "schema_version": "2.0",
  "content_version": "1.0.0",
  "topic_id": "topic.ssrf",
  "display_name": "Server-Side Request Forgery (SSRF)",
  "status": "approved",
  "category": "server-side",
  "aliases": ["SSRF", "Server-Side Request Forgery", "Request Forgery", "Blind SSRF"],

  "prerequisites": [
    "concept.url-parsing",
    "concept.dns-resolution",
    "concept.http-redirects",
    "concept.network-trust-boundaries"
  ],
  "mechanism_family": "mechanism.trust-boundary-confusion",

  "learning_objectives": [
    "Deconstruct a server-side request feature into input source, parser decomposition, DNS resolution, and connection sink.",
    "Identify how ambient network authority (source IP position) allows an external actor to bypass network segmentation.",
    "Formulate minimal, safe out-of-band and differential experiments to verify request primitives without destructive side-effects.",
    "Calibrate SSRF capabilities from blind socket creation to cloud credential theft through structured capability chains."
  ],

  "safety_contract": {
    "authorization_assumption": "Testing must only be conducted against systems and network ranges where explicit written authorization has been granted.",
    "scope_constraints": [
      "Do not scan arbitrary RFC 1918 private subnets unless designated in engagement scope.",
      "Do not access cloud credential paths (/latest/meta-data/iam/security-credentials/) without explicit scoping approval."
    ],
    "side_effect_risk": "low",
    "data_exposure_risk": "medium",
    "stop_conditions": [
      "Halt execution if internal database contents, customer records, or production secrets are returned.",
      "Do not execute mutating HTTP methods (POST, PUT, DELETE) against internal services."
    ],
    "safer_alternative": "Request the metadata root directory (/latest/meta-data/) or localhost banner rather than sensitive internal resources."
  },

  "implementation_variance": {
    "applies_when": [
      "Application executes server-side HTTP/network requests based on user input.",
      "Target server has network connectivity to internal, loopback, or cloud link-local endpoints not directly accessible to the user."
    ],
    "does_not_apply_when": [
      "Request fetching is performed strictly client-side by the user's browser.",
      "Application server is completely isolated in an egress-filtered DMZ with no access to internal networks, localhost ports, or cloud metadata endpoints.",
      "Cloud environment enforces IMDSv2 and application sink cannot craft custom HTTP PUT requests with required token headers."
    ],
    "variance_notes": [
      "In AWS, IMDSv1 permits simple GET requests, whereas IMDSv2 requires a token acquisition handshake via PUT with header X-aws-ec2-metadata-token-ttl-seconds.",
      "In GCP, the metadata service requires the 'Metadata-Flavor: Google' header, mitigating simple SSRF GET primitives unless header injection exists.",
      "In Azure, the Instance Metadata Service requires the 'Metadata: true' header."
    ]
  },

  "mental_model": {
    "one_sentence": "SSRF occurs when an application that makes server-side network requests allows an attacker to influence the request destination, causing the server to use its privileged network position on the attacker's behalf.",
    "short_explanation": "An application accepts input that determines where it sends a server-side network request. The server has a privileged network position — it can reach internal services, cloud metadata endpoints, and localhost services that external attackers cannot. When the attacker controls the destination, the server becomes an unwitting proxy: the request arrives at the target from a trusted internal IP, regardless of who initiated it. The attacker gains the server's network authority without gaining the server's identity.",
    "diagram": "Attacker\n   │\n   │ controls destination\n   ▼\nApplication\n   │\n   │ makes request from trusted position\n   ▼\nServer-side HTTP client\n   │\n   ▼\nDestination attacker cannot reach directly\n   │\n   ▼\nInternal service / cloud metadata / localhost",
    "analogy": {
      "text": "You give a delivery address to an employee who has badge access to restricted buildings. The employee delivers your package to the address you specified — inside a building you cannot enter. The building's security checks the employee's badge, not your identity.",
      "where_it_breaks": "The analogy implies a single, predictable delivery. Real SSRF involves intermediate transformations (URL parsing, DNS resolution, HTTP redirects) that can change the effective destination after validation — as if the employee follows redirect signs to a different building after the address was already approved."
    }
  },

  "invariant": {
    "statement": "Attacker-controlled input must not give an external actor unauthorized use of the server's network position.",
    "why_it_matters": "The server's network position is privileged — it includes access to internal networks, cloud metadata endpoints (169.254.169.254), localhost services, and systems protected by network-layer access controls. Unauthorized use of this position allows reading internal data, stealing cloud credentials, interacting with internal services, and bypassing network segmentation.",
    "violation_condition": "Attacker-controlled input determines the destination of a server-side request without adequate validation, and the server makes the request using its privileged network position.",
    "investigation_question": "Can an external actor cause the server to make a network request to a destination the actor specifies, and does that destination include addresses the actor could not reach directly?"
  },

  "normal_behavior": {
    "description": "The application fetches data from a predetermined, trusted backend URL. User input may influence query parameters or path segments, but the destination host is hardcoded or selected from a strict allowlist. The server's network position is not exposed to attacker control.",
    "diagram": "User request → Application → Hardcoded backend URL → Trusted internal service → Response processed"
  },

  "vulnerable_behavior": {
    "description": "The application accepts a user-supplied URL and passes it to a server-side HTTP client. The user controls the destination host. The server makes the request from its internal network position, crossing the trust boundary.",
    "diagram": "Attacker-supplied URL → Application → Server HTTP client → Attacker's destination\n                                                                    ↓\n                                                        Internal service responds\n                                                        to trusted internal IP"
  },

  "causal_mechanism": {
    "steps": [
      "1. Attacker supplies a value (URL, hostname, IP) through an application input that influences a server-side request destination.",
      "2. The application receives this value. It may validate, transform, or pass it through unchanged.",
      "3. The value reaches a server-side HTTP client — the sink.",
      "4. The HTTP client parses the URL (per RFC 3986 §3.2 for authority decomposition), resolves DNS, and initiates a connection.",
      "5. The connection originates from the server's network interface. The destination sees a request from a trusted internal IP.",
      "6. If the destination is an internal service, cloud metadata endpoint, or localhost service, it responds as if the request came from a legitimate internal component.",
      "7. The attacker observes the result — response content (full SSRF), timing/error differences, or out-of-band callback (blind SSRF)."
    ],
    "data_flow": {
      "source": "User-controlled parameter (url, stockApi, webhook, callback, imageUrl, etc.)",
      "transformations": [
        "URL validation (if any)",
        "URL parsing (RFC 3986 §3.2 authority, §2.1 percent-encoding)",
        "DNS resolution",
        "HTTP redirect following"
      ],
      "parser_or_component": "Server-side HTTP client (urllib, requests, HttpClient, curl, server-side fetch)",
      "sink_or_decision": "Outbound network connection from server's interface",
      "result": "Request reaches restricted destination using server's network authority"
    },
    "trust_transformation": {
      "attacker_data": "A string (URL, hostname, IP)",
      "parser_or_interpreter": "URL parser → DNS resolver → HTTP client",
      "new_meaning": "A network destination",
      "authority_gained": "Server's network position (internal reachability + ambient credentials)",
      "effect": "Request to a destination the attacker cannot reach directly"
    }
  },

  "exploitability": {
    "conditions": [
      {
        "condition": "Attacker controls the destination (URL, hostname, or IP in a parameter that influences the request target)",
        "how_to_test": "Can you modify the parameter to specify an arbitrary URL?"
      },
      {
        "condition": "Input reaches a server-side request primitive (the value is passed to an HTTP client, not just stored or displayed)",
        "how_to_test": "Supply your callback server URL; does the server make a request?"
      },
      {
        "condition": "Server has a privileged network position (can reach destinations the attacker cannot)",
        "how_to_test": "Is the server on an internal network with access to internal services, metadata endpoints, or localhost?"
      },
      {
        "condition": "Restricted destination is reachable from the server",
        "how_to_test": "Can the server reach the target internal service/metadata endpoint?"
      },
      {
        "operator": "OR",
        "label": "Observable capability exists",
        "conditions": [
          {
            "condition": "Response content returned to attacker (full-response SSRF)",
            "how_to_test": "Does the application display the fetched content?"